{
  "id": "CPA2019-CH1-S2-16",
  "node_type": "definition",
  "act_id": "CPA2019",
  "chapter_number": 1,
  "section_number": "2",
  "subsection_number": "(16)",
  "term": "e-commerce",
  "definition": "means buying or selling of goods or services including digital products over digital or electronic network.",
  "official_text": "\"e-commerce\" means buying or selling of goods or services including digital products over digital or electronic network;",
  "citations": [
    {
      "act": "Consumer Protection Act, 2019",
      "chapter": "I",
      "section": "2",
      "subsection": "(16)"
    }
  ],
  "references": [],
  "metadata": {
    "jurisdiction": "India",
    "language": "en",
    "version": "2019"
  }
}