{
  "id": "CPA2019-CH1-S2-9",
  "node_type": "definition",
  "act_id": "CPA2019",
  "chapter_number": 1,
  "section_number": "2",
  "subsection_number": "(9)",
  "term": "consumer rights",
  "definition": "includes,— (i) the right to be protected against the marketing of goods, products or services which are hazardous to life and property; (ii) the right to be informed about the quality, quantity, potency, purity, standard and price of goods, products or services, as the case may be, so as to protect the consumer against unfair trade practices; (iii) the right to be assured, wherever possible, access to a variety of goods, products or services at competitive prices; (iv) the right to be heard and to be assured that consumer's interests will receive due consideration at appropriate fora; (v) the right to seek redressal against unfair trade practice or restrictive trade practices or unscrupulous exploitation of consumers; and (vi) the right to consumer awareness.",
  "official_text": "\"consumer rights\" includes,— (i) the right to be protected against the marketing of goods, products or services which are hazardous to life and property; (ii) the right to be informed about the quality, quantity, potency, purity, standard and price of goods, products or services, as the case may be, so as to protect the consumer against unfair trade practices; (iii) the right to be assured, wherever possible, access to a variety of goods, products or services at competitive prices; (iv) the right to be heard and to be assured that consumer's interests will receive due consideration at appropriate fora; (v) the right to seek redressal against unfair trade practice or restrictive trade practices or unscrupulous exploitation of consumers; and (vi) the right to consumer awareness;",
  "citations": [
    {
      "act": "Consumer Protection Act, 2019",
      "chapter": "I",
      "section": "2",
      "subsection": "(9)"
    }
  ],
  "references": [],
  "metadata": {
    "jurisdiction": "India",
    "language": "en",
    "version": "2019"
  }
}