{
  "id": "CPA2019-CH1-S2-27",
  "node_type": "definition",
  "act_id": "CPA2019",
  "chapter_number": 1,
  "section_number": "2",
  "subsection_number": "(27)",
  "term": "member",
  "definition": "includes the President and a member of the National Commission or a State Commission or a District Commission, as the case may be.",
  "official_text": "\"member\" includes the President and a member of the National Commission or a State Commission or a District Commission, as the case may be;",
  "citations": [
    {
      "act": "Consumer Protection Act, 2019",
      "chapter": "I",
      "section": "2",
      "subsection": "(27)"
    }
  ],
  "references": [],
  "metadata": {
    "jurisdiction": "India",
    "language": "en",
    "version": "2019"
  }
}