{
  "id": "CPA2019-CH1-S2-23",
  "node_type": "definition",
  "act_id": "CPA2019",
  "chapter_number": 1,
  "section_number": "2",
  "subsection_number": "(23)",
  "term": "injury",
  "definition": "means any harm whatever illegally caused to any person, in body, mind or property.",
  "official_text": "\"injury\" means any harm whatever illegally caused to any person, in body, mind or property;",
  "citations": [
    {
      "act": "Consumer Protection Act, 2019",
      "chapter": "I",
      "section": "2",
      "subsection": "(23)"
    }
  ],
  "references": [],
  "metadata": {
    "jurisdiction": "India",
    "language": "en",
    "version": "2019"
  }
}